seek_url,job_detail_title,job_detail_location,job_detail_classifications,job_detail_work_type,job_detail_salary,jobAdDetails,raw_data_path,extraction_time
https://www.seek.com.au/job/87119482?type=standard&ref=search-standalone#sol=24543e653e4fd75cb44f5f8341814e13cdb703a0,Research Scientist – Computational Biology,Melbourne VIC,"Mathematics, Statistics & Information Sciences (Science & Technology)",Full time,"$120,000 – $180,000 per year","You are a high-achieving mathematics/computing graduate, eager to improve human health in partnership with a team of biologists. You are exceptional. You are conscientious, scientifically minded, intelligent and driven.What does the role involve?Our Mission: Meaningfully extend human health span by targeting the root causes of aging.Background:We are focused on genomic damage, which is well suited to analytical approaches including analysis of past data and computational modelling.We are studying the molecular damage that accumulates with age to develop strategies for slowing and reversing it.New high accuracy sequencing techniques are shining a light on these root causes of aging.We have found that to analyse this accumulation of damage, model it, design experiments and analyse the data requires advanced statistics and programming.Unlike many aspects of medicine, the genetic code is highly logical, enabling predictions through modelling.Exposure to the medical sciences is beneficial but not required.Contribute to experimental design and strategy development, using your modelling to guide and shape experiments - not just analysing data from others.You will not be expected to work in the lab and will work in partnership with our lab team.Why work at Systematic Medicine?Work on the most challenging problems. Our mission is harder than going to Mars!Problems that are meaningful.We are focused on meaningfully reducing the burden of disease. Almost all disease burden is age related.Not speeding up a trade by a nano second to squeeze out more money.Secure private funding.Work from our premium office locations in Melbourne. We are based in the new Jumar incubator at the new CSL building and have a non-lab site in a top floor office in Abbotsford.Flexible Hours. You are driven to work hard, but intelligence, mindset and strong adherence to the scientific method is more important. We expect dedicated focused time, but don't require long hours.No travel required. You're welcome to organise conference attendance or go visit other labs.Exceptional pay $120-180k (ex superannuation).What you need to applyCapabilitiesStrong stats, math and problem solving.Strong computer science and statistical coding skills in R and Python at least.ExperienceNot required, but ideally you have 2 years+ full time work experience post academia.EducationUnder grad degree in stats, math, computer science, bioinformatics, molecular biology or similar.Postgraduate studies in the above fields are useful but not required.You need to demonstrate a passion and excitement about our mission.Interview Requirements & TimelinesPlease provide a short cover letter explaining why you would be suitable for the role.The interview process is multi-stage and involved. We will provide you with documents and a question prior to interviews for you to study and ask that you provide a detailed response that will be discussed in the interview. This will require up to a couple of days work.Interviews will begin around the end of September.",data\raw\Unknown_Company_Research Scientist  Computatio_87119482_20250926_165446,2025-09-26T16:54:51.810399
https://www.seek.com.au/job/87307400?type=standard&ref=search-standalone#sol=305de27f7b253dac470d5968c1fa7c61a76eb6c4,Data Analyst,"Yarraville, Melbourne VIC(Hybrid)",Business/Systems Analysts (Information & Communication Technology),Full time,,"Are you enthusiastic about turning data into insights that drive innovation and real-world impact?As ourData Analyst, you will play a vital role in supporting the organisation through insightful reporting and data-driven analysis. Using a range of analytical tools and techniques, this role helps inform strategic decisions and improve operational efficiency.Working as part of the Applied Research and Innovation team, the Data Analyst will collaborate closely with internal stakeholders across various departments to understand business needs, identify trends, and deliver actionable insights. This position is also soon-to-be based in a new Melbourne CBD location as part of Foodbank Victoria’s site relocation.Why Foodbank?Whether it’s everyday emergencies or in times of crisis, Foodbank Victoria has been providing vital food relief to vulnerable Victorians for 95 years. We deliver food to people who need it in three different ways: in partnership with our charity partners, through schools and via our regional Community Food Centres.Across our network of over 470 charity partners and 1200 schools throughout Victoria, we have distributed over 25.1 million meals in the last 12 months and are currently feeding 69,000 Victorians a day.While supporting our charity and school partners is at the core of what we do, as the state’s dedicated emergency food relief organisation, we’re also here to assist Victorians through natural disasters, pandemics and the ‘invisible disaster’ caused by the ongoing cost of living crisis.Why we are right for you?Our people come for a career and stay for the mission!You will join an organisation full of passionate and creative people who champion and invest in the vision of helping to fight for a food secure future for all Australians.We strive for a diverse and inclusive workforce, fostering a culturally safe and supportive environment where everyone can bring their whole self to work.Our locations span across metro and regional Victoria including Yarraville, Brooklyn, Ballarat and Morwell but the warmth of our culture is unified across all sites.Imagine a future with us:• Demonstrate an understanding of ERP, CRM, and other business systems from a reporting and data integrity perspective.• Maintain systematic approach to producing reports using various packages, including Excel and BI tools.• Develop and maintain reports and dashboards to measure the success of departments, programs, and projects.• Liaise with departments across the business to identify opportunities for reporting/analysis.• Scope requirements for reports, analysis and dashboards with stakeholders from across the business.• Use research, data, analytics and a strong evidence base to inform decision-making for all FBV leaders.• Undertake data analysis to uncover trends, correlations, and insights using relevant data sources to influence business decisions.• Present findings of analysis back to key stakeholders, providing recommendations where applicable.• Extract and prepare data with strong attention to data accuracy.• Manage databases to ensure data meets agreed standards and conventions, applying data governance best practices.• Ensure compliance with Foodbank Victoria’s policies, including WHS, privacy, and financial delegations.• Actively contribute to a culture of inclusion, empowerment, and continuous improvement.Why you’re right for us:• You want to be a part of a brand that’s been around for 95 years and genuinely share our passion for our vision of healthy food for all.• Able to live and breathe our values of empowerment, accountability, integrity, respect, diversity and equality.• You have relevant tertiary qualifications and/or significant work experience.• Ideally you have previous experience in a similar data analyst role.• Experience in QlikSense, Power BI, Tableau, or other BI tools.• Knowledge of Python, R or SQL and strong MS Excel skills.• Experience working with CRM and ERP data and reports.• Proven ability to work in a collaborative and high-performing team.• Strong attention to detail and a ‘can-do’ attitude.We can offer you:• Access to salary packaging benefits to increase your take home pay.• Team member satisfaction rates above 83%.• An organisation focused on employee wellbeing.• Supportive team environment that embraces change and innovation.• Involvement in the charity work we do and volunteer opportunities.Keen to apply?• Please review the Position Description on our website in the ‘Careers’ section at Foodbank Victoria and get to know us before you apply.• Email your application toemployment@foodbankvictoria.org.au• Applications to include an up-to-date resume and cover letter.",data\raw\Unknown_Company_Data Analyst_87307400_20250926_165523,2025-09-26T16:55:29.357771
https://www.seek.com.au/job/87134966?type=standard&ref=search-standalone#sol=fca550d4bb1429f43848b47dc6ce9b73b0d44cbe,Machine Learning Engineer,"Oakleigh South, Melbourne VIC(Hybrid)",Engineering - Software (Information & Communication Technology),Full time,"$120,000 – $140,000p.a. + ESS","Two Roles available! Apply at the links below:Junior ML Engineer application form: https://forms.gle/q4F4M4vzubT5UFbCAML Engineer application form: https://forms.gle/jFGhFxfZzz8AfqKeAAbout Additive AssuranceAt Additive Assurance, we solve a major problem in metal 3D printing: making sure the parts are made right, every time. Companies in aerospace, medical devices, and other key industries use 3D printing to create amazing things, from jet engine components to surgical implants. But tiny, random flaws can cause these parts to fail. Our technology, a unique set of sensors and software, watches the printing process and catches these defects as they happen. This means safer, more reliable parts, less waste, and more trust in 3D printing as a whole. Your work here will help make this advanced manufacturing technique a reliable, everyday tool for engineers around the world.The RoleWe're looking for a talented Machine Learning Engineer to join our small, hands-on team. You'll be a driving force behind the intelligence of our system, taking ownership of our machine learning classification framework. Your primary focus will be designing, building, and refining the deep learning models that automatically detect manufacturing flaws from our unique sensor data. This is a critical role for a builder who is passionate about applying cutting-edge ML techniques to solve real-world industrial challenges in a fast-moving environment.What You'll DoDesign, train, and deploy robust deep learning models for classification and analysis of sensor data.Develop and enhance our ML framework, focusing on architectures for image and 3D data segmentationDesign and build cutting edge workflows, model architectures, and predictive models for a unique dataset.Manage the entire ML lifecycle, from data pre-processing and augmentation to model deployment and training.Collaborate closely with our software engineering team to integrate ML models into our production software.Continuously research and apply the latest advancements in machine learning to keep our technology at the cutting edge.What You'll BringProven ability to independently lead and deliver research projects with relevant experience in a machine learning or data science role.Strong theoretical knowledge and hands-on experience with deep learning frameworks like PyTorch or TensorFlow.Proven experience in developing and implementing deep learning models, particularly image segmentation methods, and familiarity with common architectures.Excellent proficiency in Python and its data science ecosystemYou must have the right to work in Australia.What We OfferInvest in Your Growth: We provide dedicated, paid time for guided and self-directed learning to help you stay at the cutting edge of machine learning.Meaningful equity through our employee share scheme – you'll have a real stake in our success.The opportunity to work on cutting-edge technology that is shaping the future of manufacturing.A dynamic and collaborative work environment based in our Oakleigh office.Ready to Join Us?If you are a passionate machine learning engineer looking to make a significant impact in a growing company, we would love to hear from you. Apply now to be a part of our journey to revolutionise manufacturing. Apply here: https://forms.gle/jFGhFxfZzz8AfqKeALocation: Hybrid/Remote (Oakleigh, Melbourne area)Preference for candidates who can be on-site at least 2 days a week.Position: Full-time, Permanent",data\raw\Unknown_Company_Machine Learning Engineer_87134966_20250926_165447,2025-09-26T16:54:53.304869
https://www.seek.com.au/job/87246833?type=standard&ref=search-standalone#sol=b60d1fbe59d7c57bf3f966bfd0d3e9c862732eb1,Senior Data Scientist - GenAI,"Cremorne, Melbourne VIC(Hybrid)",Engineering - Software (Information & Communication Technology),Full time,,"Company DescriptionAbout SEEKSEEK’s portfolio of diverse businesses make a positive impact on a truly global scale. Our purpose is to help people live more fulfilling and productive working lives and help organisations succeed. We create world-class technology solutions to connect more people to relevant employment, education, small business and volunteer opportunities. We have a culture of high-performance in our workplaces and celebrate the diversity of our employees who contribute to the success of our organisation.Life at SEEKSEEK’s purpose is at the centre of everything we do.Our SEEK, which defines the way we work, is all about what makes us unique and a little bit different. Passion, Team, Delivery and Future are our principles that drive innovation and creativity. SEEK strives to support employee wellbeing by providing an amazing experience at work which led us to being named AFR BOSS Top 10 Best Places to Work in Technology (2021-2024). We are proud to work in an environment that's inclusive where everyone's unique ideas, experiences and perspectives are valued.Our award-winning head office in Cremorne (just a 4 min walk from Richmond station) provides an exceptional space to collaborate with colleagues. The building provides sweeping views of the city, a games area, sit and stand desks at every workstation, modern end-of-trip facilities and Thursday night drinks which gives our people an opportunity to connect in a social setting.Job DescriptionThe RoleAs a Senior Data Scientist at SEEK, you'll be part of a fast-paced, supportive environment where you can make a real difference. You'll work on complex challenges that have a direct impact on people's lives, helping us evolve our business and reach new heights.You will report a Data Science Lead and work alongside other highly motivated Data Scientists in the Generative AI team. You will collaborate with product managers, designers, engineers, and others across multiple teams to design and develop Generative AI solutions for both internal and external (customer-facing) use cases.Key ResponsibilitiesIn this role, you will be expected to:Research, propose, and implement new AI solutions (and evolve existing ones) to improve a product or business outcome.Compile and develop datasets as appropriate to train or evaluate AI systems.Perform offline evaluation of AI systems and contribute to the design of online experiments.Evangelise appropriate AI methods and explain their benefits and limitations to various audiences, acting as a technical reference within the business on topics related to AI.Break down problems and projects, estimate and prioritise activities, and propose alternatives to overcome obstacles.Work together with Product Managers, Engineers, and other stakeholders to build relationships within the organisation based on trust.Mentor junior Data Scientists and share technical expertise with the DS team.The TeamSituated within the larger Artificial Intelligence & Analytics team at SEEK, the Generative AI team is a practice team focusing on GenAI. The GenAI team has two streams of work. TheApplicationsstream partners with SEEK product owners and may embed Data Scientists into the team to develop and test opportunities to build GenAI-based services. TheCapabilitiesstream builds early-stage prototypes to test the latest GenAI technology, and also develops core functionality into platform capabilities to enable sustainable scaling of GenAI services.We work on a quarterly planning cycle to develop our roadmap, which consists of internal R&D projects as well as partnerships with internal product teams, where we act as specialist consultants. As a Senior Data Scientist, you will work autonomously to deliver one or more initiatives for the team. The team runs various team rituals such as weekly stand-ups and knowledge sharing sessions, monthly team retrospectives, and others as needed. You will also attend project-related meetings as necessary.QualificationsEssential Qualifications, Skills, and ExperienceA MSc or PhD qualification in Computer Science, Data Science, Mathematics, Statistics, or equivalent experience.Professional experience developing and delivering AI/ML solutions.Deep understanding of the theory and practice of how to build, train, evaluate, and optimise AI/ML models.Excellent communication and interpersonal skills, including the ability to communicate complex ideas in simple language.Ability to adapt quickly and thrive in an environment of rapid change.The following are preferred but not essential:Demonstrated experience leading AI/ML projects and managing multiple stakeholders.Deep technical knowledge of the foundations of Generative AI: deep learning; transformers; encoder/decoder models; pre-training and post-training; RLFH; LORA.Hands-on experience training or adapting large language models.Hands-on experience building solutions with pre-trained LLMs, using techniques such as prompt engineering, RAG, agentic workflows, etc.Experience with conversational design and developing conversational AI systems.Additional InformationPermanent PerksAt SEEK we offer:Support of flexible working, including a mix of office and work from home days depending on your role.Paid and unpaid leave benefits including Personal Flexi Days and Volunteer Days, as well as the opportunity to purchase additional leaveSupport for parents with 14 weeks paid primary carers leave and 2 weeks paid leave for partnersSEEKer Support, a confidential service that offers employees up to six sessions with a mental health professional of your choiceTailored career development planning (including Education Assistance Program)At SEEK, we are passionate about fostering a culture of inclusion and wellbeing that embraces and values the diversity of our people. We are a purpose driven business that works with heart.We know teams with diverse ideas, experiences and perspectives are more creative and are critical to ensuring effective delivery and innovating to enable our future success. As such, we welcome applications from people with diverse backgrounds and life experiences, especially as they relate to gender, sexual identity, culture, faith, disability and life stages. If you have the skills, curiosity and an adaptable mindset but don't meet every responsibility or qualification listed in this advertisement, please still get in touch with us.Should you require any specific support or adjustments throughout the recruitment process and beyond, please advise us and we will be happy to assist.For this role, only those candidates with the eligible right to work will be considered.SEEK kindly requests no unsolicited resumes or approaches from recruitment agencies and will not be responsible for any associated fees.",data\raw\Unknown_Company_Senior Data Scientist - GenAI_87246833_20250926_165547,2025-09-26T16:55:55.288762
https://www.seek.com.au/job/86940798?type=standard&ref=search-standalone#sol=a3499d218f53f9921f6ae3869f5948fe8c300e3b,Data Scientist - Leading Gov Health Agency,Melbourne VIC(Hybrid),Government - Federal (Government & Defence),Contract/Temp,AUD 400 - 450 per day,"Data Scientist - Lading Gov Health AgencyJoin a purpose-driven Analytics team of a leading Government health organisation, that is using data science to support and help deliver programs that change lives.This is a 12 months Day Rate Contract with strong possibility of extension for another 12 months. Candidates must be based in Melb or Brisbane, with hydrid work arrangements - 2-3 days in the office/ rest from home.Australian Citizenship a must.About the TeamThe Analytics, Data & Actuarial (ADA) Division drives insight, forecasting and evaluation to ensure long-term sustainability and impact.Actuarial Insights & Monitoring – providing trusted analysis and advice.Data & Analytics – turning complex data into actionable insights.Scheme Effectiveness & Forecasting – measuring outcomes, evaluating supports, and monitoring financial sustainability.From producing the Annual Financial Sustainability Report to delivering strategic modelling and policy advice, the team plays a pivotal role in shaping evidence-based decision-making and future outcomes.As aData Scientistyou’ll:Work with complex data to deliver reporting, analysis and performance monitoring.Extract, cleanse and prepare data from multiple sources, advising on quality and checks.Apply statistical and predictive modelling, scenario testing and data visualisation to inform decision-making.Contribute to critical reporting for leadership, Ministers and public data sharing.Communicate insights to stakeholders and provide advice on moderately complex enquiries.What we’re looking for:2-3 yearsof relevant analytics or data science experience in gov or other similar agencies with good analytical and data management skills.Hands-on skills and exp inR or Python programming, including data manipulation and analysis.Hands-on experience and skills inSQL / SAS programming.Understanding ofstatistical modelling (GLM, gradient boosting)ormachine learning techniquesa must.Experience in dashboards and visualisations for non-technical stakeholders a big plus.Familiarity with government processes (policy, budget, reporting) a plus.This is your chance to use your technical expertise to influence policy, support national reporting, and contribute directly to outcomes that make a difference for Australians.",data\raw\Unknown_Company_Data Scientist - Leading Gov H_86940798_20250926_165545,2025-09-26T16:55:51.778180
https://www.seek.com.au/job/87229732?type=standard&ref=search-standalone#sol=8d07388a0e86e40d9c089cfdc9cc5e3c45c8b025,Data Engineer,"Hawthorn, Melbourne VIC(Hybrid)",Developers/Programmers (Information & Communication Technology),Full time,,"Data Engineer – MAGIQ SoftwareAbout MAGIQAtMAGIQ Software, we build smart, cloud-based applications that help local governments and public sector organisations deliver for their communities. With over600 customersacross Australia, New Zealand, and the USA, our product suite includesMAGIQ Cloud ERP, MAGIQ Performance (budgeting & reporting), and MAGIQ Documents.We’re a team of80+ professionalspassionate about delivering great software and outstanding customer service - and we want you to join us.About the RoleWe’re looking for anexperienced Data Engineerto join our growingData & Reporting team. You’ll design and maintaindata pipelines and ETL processesthat power the reporting and analytics capabilities of our MAGIQ Performance product.This role is hands-on withSQL, XML-based connectors, and diverse data sources(APIs, SQL system dumps, structured extracts). You’ll collaborate closely with product and consulting teams, ensuring customers have reliable and accurate data solutions that align with financial and operational needs such asGeneral Ledger, Payroll, and Labour Budgets.What You’ll DoDesign, build, and optimise ETL pipelines and SQL data models.Work withXML connectorsand schema management.Ingest and transform data from APIs, extracts, and SQL systems.Ensure data quality, consistency, and reliability.Collaborate with Product Owners and Consultants to deliver actionable reporting solutions.Troubleshoot escalated issues and provide long-term fixes.Contribute to Agile ceremonies and team collaboration.What You’ll BringBachelor’s in Computer Science, Information Systems, or equivalent experience.4+ years’ experiencein data engineering or related roles.Strong SQL skills across large and varied datasets.Experience withXML-based data connectors.Knowledge of APIs, SQL dumps, and structured extract transformations.Solid understanding of relational databases and schema design.Domain knowledge infinance-related data(GL, Payroll).Excellent troubleshooting, problem-solving, and communication skills.Agile or hybrid delivery experience.Bonus: Certifications or experience inbig data or financial data systems.Why Join MAGIQ Software?Work on impactful products that empower councils and the public sector.Join a supportive, collaborative team spread across AU, NZ, and the USA.Be part of a company that valuesinnovation, professionalism, and continuous improvement.Enjoy the chance to make a real difference in how communities are served.This is a hybrid role, requiring three days per week in the office.If you're passionate about innovation and customer success, we invite you to apply and become part of our Melbourne-based team.Learn more about MAGIQ Software at www.magiqsoftware.com.We look forward to receiving your application.",data\raw\Unknown_Company_Data Engineer_87229732_20250926_165549,2025-09-26T16:55:57.102704
