seek_url,job_detail_title,job_detail_location,job_detail_classifications,job_detail_work_type,job_detail_salary,jobAdDetails,raw_data_path,extraction_time
https://www.seek.com.au/job/86932068?type=standard&ref=search-standalone#sol=0dbc8f89840136bfa952997914c9ccb0a194669d,Data Scientist,"Docklands, Melbourne VIC(Hybrid)",Developers/Programmers (Information & Communication Technology),Full time,"$80,000 + superannuation","Company:MarshDescription:Permanent, Full-time opportunity (37.5 hours per week)Convenient Docklands Location – 727 Collins StBase salary of $80,166We are seeking a talentedData Scientistto join ourJLTteam atMarsh.This role will be based in theMelbourneoffice. This is a hybrid role that has a requirement of working at least three days a week in the office.As aData Scientistyou will develop BI and Data models with emphasis on QlikView data models and dashboards to support internal and external client needs. The role requires complete comprehension of enterprise data models and utilization of both relational and dimensional data sources.We will count on you to:Perform detailed analysis of source systems and source system data and model that data in QlikView;Design, develop, and test QlikView scripts to import data from source systems and test QlikView dashboards to meet customer requirements;Interpret written business requirements and technical specification documents;Create and maintain technical design documentation;Perform quality coding to business and technical specifications;Work directly with business units to define and prototype QlikView Applications;Extracting, transforming and loading data from multiple sources into QlikView applications Monitoring and maintenance of all components that make up the Data Warehouse and Business Intelligence infrastructure;Act as evangelist for BI benefits across the organization; promote BI usage to relevant departments;Responsible for demonstrating software to internal users;Participate in design meetings;Create standards and prototypes;Prepare and maintain relevant technical documentation.What you need to have:Experience in developing / architecting BI Solutions supporting financial, sales and performance reporting;Experience in sourcing data from disparate systems with a good understanding of their Data Models;Hands-on professional with thorough knowledge of scripting, data source integration and advanced GUI development in QlikView;Full understanding of the processes of data quality, data cleansing and data transformation Ability to write complicated yet efficient SQL queries and stored procedures;Strong knowledge on QlikView server architecture and building qvd’s and qvw’s applying business rules and data validations;Experience in end-to-end implementation of Business Intelligence (BI) projects, especially in scorecards, KPIs, reports & dashboardsKnowledge of formal database architecture and design;Tertiary education with a degree in computer science, information technology, information systems, or a related discipline;Detail-oriented with strong organizational, analytical and communication skills;Results-driven with the ability to take initiatives, handle multiple tasks and shifting priorities and meet deadlines;Excellent problem solving skills, logical process thinking and end-to-end system conceptsThinks clearly and calmly under pressure;Places emphasis on client satisfaction;Promotes the mission and shared values of JLT and Marsh;Excellent interpersonal and organisational skills with a strong ability to articulate and communicate ideas, work requirements and performance based matters in an empathetic manner;Self-motivated and results driven with a consultative approach.Why join our team:We help you be your best through professional development opportunities, interesting work and supportive leaders.We foster a vibrant and inclusive culture where you can work with talented colleagues to create new solutions and have impact for colleagues, clients and communities.Our scale enables us to provide a range of career opportunities, as well as benefits and rewards to enhance your well-being.How to Apply:Follow the link to apply. Applications will be open from03 Septemberto01 October.Applications will only be considered from candidates who have the appropriate approval to work in Australia. Successful applicants will be required to complete a Criminal & Bankruptcy check prior to commencement of employment.About MarshMarsh, a business of Marsh McLennan (NYSE: MMC), is the world’s top insurance broker and risk advisor. Marsh McLennan is a global leader in risk, strategy and people, advising clients in 130 countries across four businesses: Marsh, Guy Carpenter, Mercer and Oliver Wyman. With annual revenue of $24 billion and more than 90,000 colleagues, Marsh McLennan helps build the confidence to thrive through the power of perspective. For more information, visit marsh.com, or follow on LinkedIn and X.Marsh McLennan is committed to creating a diverse, inclusive and flexible work environment. We aim to attract and retain the best people and embrace diversity of age, background, disability, ethnic origin, family duties, gender orientation or expression, marital status, nationality, parental status, personal or social status, political affiliation, race, religion and beliefs, sex/gender, sexual orientation or expression, skin color, or any other characteristic protected by applicable law.Marsh McLennan is committed to hybrid work, which includes the flexibility of working remotely and the collaboration, connections and professional development benefits of working together in the office. All Marsh McLennan colleagues are expected to be in their local office or working onsite with clients at least three days per week. Office-based teams will identify at least one “anchor day” per week on which their full team will be together in person.",data\raw\Unknown_Company_Data Scientist_86932068_20250926_165350,2025-09-26T16:53:58.602915
https://www.seek.com.au/job/87195137?type=standard&ref=search-standalone#sol=f4f2bcd35bc680069198ff947da194cc96b11d16,Junior Data Analyst,Melbourne VIC,Business/Systems Analysts (Information & Communication Technology),Full time,$60-75K + Super,"Location:Toorak, Melbourne | In-office Monday-FridaySalary:$60k–$75k + super (depending on your experience)Is this you?You want to take the first real step in your career.You take pride in getting the details right, even when the task is repetitive.You’re eager to learn, open to feedback, and keen to grow over timeThis opportunity might be for you…Join one of Australia’s fastest-growing fintechs in a supportive team that needs someone who loves getting the details right. You’ll start by owning the foundations (keeping our data clean, fixing errors, and checking reports). Nail that, and you’ll grow into bigger projects that add real value.This role will suit you ifyou are open to new ways of doing things - we don’t want a robot!you want to be part of an supportive team that enjoys getting things done together.you want to work hard and have an impact.What’s on offer:A role that builds your career step by step - start with the foundations and grow into bigger projects.A great workplace culture (we have won awards for it!) where the value you create is what counts.A manager who backs you with feedback, coaching and opportunities to grow.Personal and professional development, we’re committed to supporting our people with coaching and programs.A fun, energetic office environment in Toorak (you should see the views!)Regular company events, activities and weekly company-wide lunches.Who are we looking for?We’re looking for passionate, ambitious individuals who want to contribute to big things. Years of experience are just a number. Contribution and dedication are what matter.Must-havesOpen-minded and curiousReliable, detail-oriented, and thorough in your work.Egoless and collaborativeAction-oriented and great at getting things doneNice to have:This role requires baseline comfort with spreadsheets and data operations.Graduate in Data/Business/Science fields OR relevant work experience.Competence in Excel/Google Sheets.Exposure to reporting tools (Looker, Quicksight).Curiosity about Python or other scripting languages.What you’ll be doing:Keeping our data cleanand useful by uploading leads, fixing errors, and removing duplicates.Cross-checking and maintaining operational reportsand dashboards.Working with internal teamsto fill in missing info and fix inconsistencies.Helping document and implement business rulesas we roll out our new data warehouse.Raising issueswhen things don’t look right - and helping to fix them.Over time, usingQuicksight to build new dashboardsand support decision-making.About BizcapBizcap is one of the world's fastest-growing Fintech companies. With just over 100 people in their agile, diverse and high-performing team, they've funded over $1.5b in loans and are rapidly expanding internationally. They have won a range of awards for their workplace and culture, from Best for Small Business Loans, Best Workplace Diversity, Best Employee Culture and Diversity, and Outstanding Customer Service.How to ApplyWe use a reflective exercise to understand how you think, what you care about, and how you approach work - it's not a test, and there's no ‘right' answer; it's a way for us to understand you beyond your CV.Once you apply, you'll receive an invitation to complete the 15-minute exercise. If we feel it's a good fit, we'll be in touch to set up a conversation to get to know you better.",data\raw\Unknown_Company_Junior Data Analyst_87195137_20250926_165351,2025-09-26T16:53:59.156741
https://www.seek.com.au/job/87094436?type=standard&ref=search-standalone#sol=8f5c62dea0e074582c69255438aaa33da5c97c5d,Data Scientist,Melbourne VIC(Hybrid),Developers/Programmers (Information & Communication Technology),Full time,,"Company DescriptionFairness feels goodMake a real impact at AFCA. Where fairness drives every decision. Help us deliver world-class, independent complaints resolution for Australians. As a not-for-profit and progressive financial ombudsman, we’re championing positive change. Achieving our purpose takes progressive thinking, accountability and resilience. At AFCA, our inclusive leadership values every voice. We offer our people flexible work options, thoughtful benefits and opportunities to deepen expertise. Flourish in a diverse, caring culture. Feel the difference of belonging to an organisation intentionally designed to put people first.Job DescriptionTheData Scientistrole will be pivotal in ensuring the continuity and growth of AFCA’s AI services and AFCA achieving and implementing its future AI and data roadmaps. We’re looking for a Data Scientist to harness AFCA’s modern data platform and Microsoft services to uncover patterns, trends, and relationships across structured and unstructured data. You’ll build classification, prediction, and optimisation models that deliver tailored, actionable insights.Working with internal teams and external partners, you’ll help deliver sustainable, innovative, and ethical AI solutions that support AFCA’s strategic goals. We currently have two open positions, 1 x permanent and 1 x 12 month contract.Typically in this role, you will:Design, implement, and test analytical models using tools like Azure Databricks, Synapse Analytics, and AI FoundryLead experiments to compare analytical methods and refine performanceDeploy solutions within AFCA’s change management framework and monitor performance over timeParticipate in requirements workshops and contribute to solution designCollaborate with report developers to communicate insights through reports and visualisationsAct as a bridge between business needs and technical deliveryMaintain analytics workloads and support continuity of data science servicesRespond to alerts/outages and escalate as neededProvide project support, including coordination with third-party providersMaintain high-quality documentation (requirements, evaluations, code repositories)Build prompt libraries and guardrails in Azure AI FoundryDefine success metrics (accuracy, bias, hallucination rate) and run A/B testsLead design and evaluation of LLM and RAG-based solutions, including fine-tuning modelsQualificationsTo be successful, you will need:A degree in Computer Science, Information Technology, or a Data related field,Proven experience of relevant experience in working with advanced analytics platforms, data science and/or data and AI projects.Strong knowledge and experience in data science technologies including Databricks, Python, SQL, ML, AI and/or generative AI concepts/tools.Experience in deploying LLM-based solutions using Azure OpenAI or similar tools.Knowledge of data analysis, deep learning, statistics, artificial intelligence, and knowledge of relational and dimensional data models.Strong interpersonal skills including oral and written communication skills.Strong attention to detail, initiative and the ability to work unsupervised.The ability to adopt a flexible/ innovative approach to problems and opportunities.Additional InformationBOSS Best Places to Work 2024–credited for its culture, engagement and flexible working arrangements.Most Inclusive Workplace 2024– Australian HR Institute (AHRI) Awards.Employer of Choice Public Sector and NFP– Australian HR Awards 2023Silver AWEI Accreditation 2025– Recognised for LGBTQ+ workplace inclusion.Accredited Family Friendly Workplace– Supporting work-life balance and inclusivity.Hybrid working– Flexible arrangements with state-of-the-art offices designed for collaboration and wellbeing.Inclusive leave options– Flexible public holidays, 20 weeks paid parental leave, gender affirmation leave, women’s health leave, and paid time off over Christmas.Financial benefits– Not-for-profit salary packaging to boost take-home pay.Locations– A team of over 1,200 dedicated professionals based in modern Melbourne and Sydney CBD offices.To applyIf you’re passionate about fairness and believe your skills align with this role, we encourage you to apply even if you don’t meet every single criterion.We welcome applications from people of all backgrounds, cultures, abilities, sexual orientations, and gender identities. If you require any accessibility support during the recruitment process, please reach out to our team atCareers@afca.org.au.AFCA is a 2025 Circle Back Initiative Employer - we are committed to responding to every applicant.",data\raw\Unknown_Company_Data Scientist_87094436_20250926_165351,2025-09-26T16:53:59.295282
https://www.seek.com.au/job/86802471?type=standard&ref=search-standalone#sol=c6fc3573e8e255548d6ba6db80d1b548b89f3fdb,Data Analyst,Melbourne VIC,Analysis & Reporting (Banking & Financial Services),Full time,,"NOW Finance is a purpose-driven fintech with a simple aim: to create simple and transparent financial solutions, empowering Aussies to live their dreams – now!We are seeking a Data Analyst who is passionate about numbers and data, and able to connect business drivers to data-driven recommendations that shape the future of finance. Leverage cutting edge tools to provide insights and build reports to support various parts of our business across Marketing, Treasury, Risk and Operations.NOW Finance offers flexibility of one day per week WFH on completion of probation.Key responsibilities include:Partner with internal stakeholders to solve business problems through data analysis and insights.Support strategic initiatives to drive business outcomes – includes data-driven strategies and data infrastructure work.Identify and interpret trends or patterns in complex data sets.Create and maintain dashboards in Power BI enabling business users to automate and improve current work processes.Build and deploy automated tasks to extract and transform data.Communicate findings, insights and recommendations to a range of stakeholders.Attributes, Experience & Qualifications:Solid programming skills in SQL is mandatory and Python is highly desirable.Experience with at least one data visualization tool (e.g. Power BI) is also mandatory.Degree qualified in a numerate discipline, i.e., relevant STEM, Actuarial or Econometrics degreeAn analytical mind that can balance detail with the big picture.Team player with sound organisational and prioritisation skills.Strong written and verbal communication.Ability to work in a dynamic environment and flex with changing pace.Up to 2 years’ work experience - preferably in the areas of credit risk/marketing analytics, data visualization or machine learning.Financial background and experience desirable.AtNOW Financewe support and encourage our employee's personal and professional development – What we can offer you is:A dynamic work culture, with the opportunity to develop.A career path within Data & AnalyticsThe opportunity to work within a fun and energetic team, alongside a supportive leadership teamA positive work environment, great office space, weekly fruit delivery and free coffee!NOW Finance BenefitsAn annual Wellness DayFlexibility post probationEntry to our Employee Benefit Portal offering discounts, perks, and wellness resourcesDiscounted health insuranceA substantial referral bonusEmployee Reward and Recognition",data\raw\Unknown_Company_Data Analyst_86802471_20250926_165417,2025-09-26T16:54:23.681199
https://www.seek.com.au/job/87173977?type=standard&ref=search-standalone#sol=f8fa72dc2174ad9076cfc292ccac74fa2a9528bd,"Blackbook AI Graduate Program, Early 2026",Melbourne VIC(Hybrid),Developers/Programmers (Information & Communication Technology),Full time,,"OverviewAre you a tech-savvy graduate looking to kickstart your career in the exciting world of artificial intelligence, automation, data or digital? Blackbook.AI, a leading technology consulting company, is seeking ambitious graduates to join us in early 2026.What you'll be doingAs part of our team, you'll have the opportunity to work within one or more of the following practices:Data Science:Our team leverages Classical ML, Deep Learning, Neural Networks to solve customer problems.Applied/Gen AI:Our team leverages cloud based services such as AI Foundry, Mosaic, Bedrock, Open AI, Copilot to craft solutions to solve customer problems.Data:Develop your data engineering and analytics skills, to extract, transform, merge, model, analyse and present insights for our customers.Automation:From Robotic Process to Agentic Automation, design, develop, manage automations for our customers.Digital:Develop, Integrate, Test and Support Digital Solutions.Participate in a our hands on driven training program to develop your technical and interpersonal skills.Collaborate with cross-functional teams to design and implement innovative AI solutions for our clientsContinuously learn and stay up-to-date with the latest advancements in technologyWhat we're looking forA recently completed bachelor's degree in Engineering, Computer Science, Data Science, or a related technical fieldStrong problem-solving and analytical skills, with a keen interest in AI and emerging technologiesA collaborative mindset and the ability to work effectively in a team environmentWhat we offerAt Blackbook.AI, we are committed to providing our employees with a supportive and stimulating work environment. As a Graduate Program participant, you'll have access to a range of benefits, including:Competitive salary and bonusesOngoing training and development opportunitiesMentorship from industry-leading expertsFlexible work arrangements and a focus on work-life balanceAccess to the latest AI technologies and toolsOpportunities for career progression and growth within the companyAbout usBlackbook.AI is a dynamic and innovative AI driven consulting company, dedicated to pushing the boundaries of what's possible with artificial intelligence. Our mission is to create transformative AI solutions that improve lives and drive positive change. We are a team of passionate and dedicated individuals, united by our shared love of technology and our commitment to making a difference.Locations we are hiringBrisbane, Melbourne and SydneyAbout youMandatory:Must have full Australian working rightsHave graduated 2023 to December 2025 and available to start in February 2026Apply nowto be a part of our exciting Blackbook.AI Graduate Program and embark on a rewarding career in the cutting-edge field of artificial intelligence leveraged solutions.Applications Close: 30 September 2025",data\raw\Unknown_Company_Blackbook AI Graduate Program _87173977_20250926_165417,2025-09-26T16:54:23.415098
https://www.seek.com.au/job/87231857?type=standard&ref=search-standalone#sol=8d2a86f29ccea065443b36b90ca6e731c55847e0,Lead Data Scientist,Melbourne VIC(Hybrid),"Mathematics, Statistics & Information Sciences (Science & Technology)",Full time,,"We are currently partnering with a well-known Australian organisation that is seeking a Lead Data Scientist to join their established data function. This role, reporting directly to the senior leader across AI, this role will be central in leading a small team of data scientists and executing the organisation’s AI strategy, with a strong focus on advanced ML techniques and large language models (LLMs).This role is a hands-on leadership opportunity where you will combine people leadership with deep technical expertise in designing, developing, and deploying ML, AI, and LLM-based solutions. You will be accountable for embedding best practices, ensuring production readiness, and driving real-world impact from advanced analytics initiatives.What you will be doing…..Lead and mentor a small team of data scientists to deliver innovative AI and ML solutions.Execute the organisation’s AI strategy, with a particular focus on LLM adoption and applied use cases.Design, develop, and deploy ML, AI, and LLM models into production environments.Establish and maintain best practices, frameworks, and standards for scalable AI delivery.Ensure the ethical and responsible use of data and AI in line with organisational policies.Drive model reliability, accuracy, and validation through robust testing and governance.Partner with business and technology stakeholders to maximise adoption, value creation, and impact.Your experience will include……4+ years of experience as a Data Scientist, with recent experience in a leadership or team management role.Proven success in executing AI and data science strategies within complex organisations.Strong expertise in designing, developing, and deploying ML, AI, and LLM-based models into production.Technical depth in Python, R, BI tools, Azure and ML/AI frameworks.Advocate for practical, ethical, and innovative applications of AI and LLMs.Excellent stakeholder engagement and communication skills, with the ability to influence across technical and business teams.To be considered for this role, you must be an Australian Permanent Resident or Australian Citizen.If this position is of interest to you, please click ‘Apply’ or you can just send your details toraed@konnexuscg.com.auKonnexus specialises in the recruitment of permanent and contract professionals within Data Analytics | AI/ML | Data & Platform Engineering. If this role is not right but you want a new position or a conversation about the market, please call us on03 9052 5900and we will pass you onto the right Consultant.",data\raw\Unknown_Company_Lead Data Scientist_87231857_20250926_165416,2025-09-26T16:54:23.553222
