seek_url,job_detail_title,job_detail_location,job_detail_classifications,job_detail_work_type,job_detail_salary,jobAdDetails,raw_data_path,extraction_time
https://www.seek.com.au/job/87023820?type=standard&ref=search-standalone#sol=87b51df93634dc54545e4a545633235e0600281f,Graduate Data Analyst,"Dandenong, Melbourne VIC",Database Development & Administration (Information & Communication Technology),Full time,$70000 + super,"About the RoleReporting to the Planning & Development Manager, you’ll play a key role in helping us make smarter decisions through data. You’ll work with internal teams and external stakeholders to analyse performance, identify trends, and support continuous improvement across our operations.What You'll Be Doing• Utilise software including Excel, PowerBI, BusMinder, Smartrak and Myki Analytics data to compile reports on KPI’s including allocation, on-time running and missed services.• Collaboration with Network Planners for data research and timetable analysis to identify improvement opportunities.• Providing analytical and reporting support to departments such as Fleet, HSEQ and Operations.• Extract, interpret and analyse data using statistical techniques to identify variances, trends and discrepancies.• Reporting on business KPI’s for compliance and performance to our stakeholders and regulatory bodies.• Develop and implement databases, data collection systems, data analytics and other strategies that optimize statistical efficiency and quality.About YouWe’re looking for someone who’s:• A demonstrated background in a similar position with a strong focus on data analytics and reporting.• Tertiary Qualifications in relevant discipline preferred, but not essential.• Previous experience with PowerBI, Tableau or Python.• Strong analytical skills with the ability to collect, organize, analyse, and disseminate significant amounts of information with attention to detail and accuracy.• Exceptional attention to detail and ability to deliver within defined regulatory deadlines.Why Join Ventura?What Ventura Can Offer You• Work within an established, inclusive, and supportive team.• An exciting, dynamic and ever evolving workplace providing opportunity to create content for various departments.• A secure, dependable and robust environment.• Excellent facilities, onsite parking and employee events.• Walking distance to a major public transport hub, Dandenong Railway Station.About Ventura Bus LinesVentura is Australia’s largest privately owned bus company, moving over 42 million passengers annually. With 1700+ employees and 900+ vehicles, we’re committed to delivering safe, sustainable and reliable transport across Melbourne.Ready to Apply?If you’re excited to launch your career in data analytics, we’d love to hear from you!?? Contact Emmy on(03) 9771 4363for more info or?? Click “Apply Now” to submit your application.",data\raw\Unknown_Company_Graduate Data Analyst_87023820_20250926_165617,2025-09-26T16:56:24.746655
https://www.seek.com.au/job/87320610?type=standard&ref=search-standalone#sol=be4cc8087838a793f93611c87040c88225561892,Data Analyst,Melbourne VIC(Hybrid),Business/Systems Analysts (Information & Communication Technology),Full time,,"A bit about usAt Judo, we're more than just a business bank – we're pioneers in redefining business banking for the modern era. Rooted in timeless values such as integrity, trusted relationships, and a challenger spirit, we're dedicated to revolutionising business banking for Small to Medium Enterprises (SMEs) across Australia. Our journey began in 2016 with a bold vision and a PowerPoint slide, driven by a desire to challenge the status quo in an industry dominated by the major players. In just a few short years, we've grown exponentially, establishing ourselves as one of the fastest-growing new banks globally, with 27 offices spanning the nation.At the heart of our ethos lies a commitment to supporting Australian SMEs, placing our people and customers front and centre in everything we do. Our agility and adaptability enable us to say 'yes' when other banks say 'no', making it easier for our customers to secure the funding they need, precisely when they need it. We take immense pride in our personal approach to banking, fostering diverse relationships and cultivating a collaborative culture within our team.Our culture – come and join a multi-award-winning place to workWe firmly believe that culture eats strategy for breakfast, lunch, and dinner and the most important investment we can make is in our people. Our Values of trust, teamwork, accountability and performance underpin the foundation of our culture.We're not your average bank. Judo was built from the ground up, with one purpose: to be the most trusted SME business bank in Australia. We made sure to cultivate a space where bureaucracy is left at the door - where our customers come first with relationships at the core of what we do. We aspire to think differently, inviting new ideas, and creating a space where everyone feels like they belong because we know that it's our unique differences that make us collectively stronger.We are thrilled to be externally recognised for our unique culture too! We were awarded the #1 ranking in LinkedIn’s Top Companies in Australia list as well as named in the AFR’s BOSS Best Places To Work list for 3 years in a row. We’re also super proud to be included in the 2024 HRD Australia 5-Star Employers of Choice list and officially be Great Place To Work Australia certified!Our people and our culture are truly our secret sauce.Now, about this role…This role is about turning complex data into clear, actionable insights that help shape business decisions.You'll work closely with stakeholders to deliver meaningful reporting and drive continuous improvement across the bank.If you love:Collaboration and influence: Building and maintaining strong relationships with internal stakeholders to understand their needs and drive data-informed decisionsUncovering hidden patterns: Diving deep into data to solve business problems, identify opportunities and challenge conventional thinkingTransforming data into insights: Designing and developing insightful reports and dashboards that clearly communicate complex information and drive actionTurning data into action: Preparing data for use in predictive and prescriptive modelling to unlock the full potential of data-driven solutionsMaking a real-world impact: Applying your analytical skills to answer critical industry and business questions that contribute to the success of Australian SMEThen this just might be…your dream job:Empowerment and ownership: You'll have the autonomy to gather business requirements, translate them into analytical solutions and own the end-to-end data analysis processCollaboration and innovation: You'll work with Data Engineers and Subject Matter Experts in a modern, cloud-only technology stack, to build cutting-edge data solutionsData quality champion: You'll play a key role in improving data reliability, quality and efficiency, ensuring that our data is a trusted assetImpact and visibility: You’ll work with senior stakeholders in the bank to deliver insights that will contribute to the growth of one of Australia's fastest-growing banksContinuous learning: You'll have the opportunity to expand your skills in data analysis, visualisation and modelling and contribute to a data-driven cultureA little bit about you…We’re looking for someone who brings strong communication skills, a collaborative mindset and the ability to bridge the gap between technical detail and business needs.You’ll thrive here if you enjoy building connections, bring a positive energy and are ready to contribute to a supportive and high performing team.The skills you’ve picked up along the way:Advanced Power BI skills: Proven experience designing and building insightful dashboards that drive data-driven decision-makingStrong analytical foundation: Exceptional analytical, critical thinking and problem-solving abilities with a passion for uncovering insights from data. Experienced in statistical analysis.Programming proficiency: Proficiency in SQL for data analysis, manipulation and extractionData wrangling expertise: Medium-level SQL skills, including the ability to write, optimise and troubleshoot complex queriesData warehousing knowledge: Exposure to data warehousing concepts and dimensional modelling techniquesCollaboration with data science: Experience working with Data Scientists and Machine Learning Engineers, or prior experience in a data science roleYour life pre-Judo:Requirements gathering: You have worked in roles where gathering and documenting business requirements from stakeholders was a key aspect of your dutiesStakeholder management: You know how to effectively collaborate with and manage stakeholders across different teams, across the spectrum of business, operations, data and technologyExcellent communication: Your written and verbal communication skills are exceptional and you know how to present complex information clearly and concisely and translate business concepts into technical solutions - and vice versaThese would be a plus:Experience with Data Vault data modelsExperience in the Financial Services industryExperience working in an agile environmentAt Judo, our culture sets us apart.Our Values:Accountability: Make decisions and own them. Do what you say.Performance: Strive to improve each day, surpassing yesterday's achievements.Teamwork: We're not just a team; we're a champion team.Trust: The cornerstone of our purpose and relationships.We're seeking individuals who embody resilience, positivity, curiosity, hunger for success, adaptability, passion, courage, decisiveness, and a hands-on approach.What our team members say about us:Our people are empowered to make decisions, take ownership, and contribute to a collaborative environment. Bureaucracy is non-existent as we focus on collective success. At Judo, diversity isn't just valued; it's celebrated. We're committed to creating an inclusive environment where everyone thrives, making us collectively stronger. Our team works tirelessly towards our purpose while enjoying the journey of revolutionizing Australian SME business banking.Perks of joining us:Additional 2 weeks of leave annually (that’s 6-weeks per year!)Big life event leaveHome office setup allowanceAccess to CU HealthFlexible work options, embracing a true hybrid model.If this resonates with you, reach out - we'd love to hear from you.To learn more about how Judo manages your personal information during the recruitment process, please refer to our Privacy Statement. By providing your information, you consent to its collection, use, disclosure, and management as outlined therein.Please no agencies! We maintain a preferred panel, and kindly request no unsolicited contact. We do not hold any responsibility for dispute over candidate ownership if you have not been engaged directly.",data\raw\Unknown_Company_Data Analyst_87320610_20250926_165615,2025-09-26T16:56:25.063780
https://www.seek.com.au/job/87425061?type=standard&ref=search-standalone#sol=1bb209e91c1d1a66fdbf0f386bb69e5b9e23dba5,DATA & BUSINESS ANALYST | ENERGY,Melbourne VIC(Hybrid),Business/Systems Analysts (Information & Communication Technology),Full time,"$90,000 - $120,000","About the companyThis role is working for a leading energy & sustainability consultancy that help large businesses decarbonise and cut energy costs. The organisation have a team across multiple states in Australia who are technical specialists providing energy engineering and technical services for the creation of carbon credits energy savings certificates for things like solar and energy reduction such as LGC's, STC's, VEEC's and much more.This brand combines deep technical expertise with a strong purpose: creating real impact on climate change.The positionWe’re looking for a Business/Data Analyst who loves solving complex problems, optimising processes, and building smart data tools, this role is for a doer who can interpret business processes and turn them in to automation.Reporting to the GM, you’ll streamline workflows, automate systems, and deliver insights through Power BI, Salesforce and other platforms. Your work will directly support smarter decision-making and measurable sustainability outcomes.In this role you will:Map, analyse and improve core business processesAutomate workflows to save time and cut errorsBuild dashboards and reporting tools to inform strategyIntegrate systems (Salesforce, Power BI, Mission Control, Xero) for seamless operationsTranslate data into insights that drive growth and efficiencyAbility to bring genAI or AI tools forward would be highly regardedExperience neededStrong skills in Excel especially,Skills in Power BI (or Tableau), driving integrations, and data analysisExperience with platforms like Salesforce or anything relatedExperienced with process automation and integration toolsBackground in business process optimisation and reportingBenefit but not essential to have exposure to energy, sustainability or environmental sectorsBenefit to come from the energy certificate market or an APSeveral years experience in a Business Analyst / Data Analyst roleAbility to bring genAI or AI tools for business improvement would be highly regardedBenefitsCompetitive salary + annual reviewsProfessional development supportFlexible work options after probation (up to 2 WFH days)Travel, phone, and expenses covered in line with company policyJoining a collaborative, high-performing team making real impactApply nowIf you’re ready to use your skills to help a business on a mission with clear purpose for decarbonisation and sustainability, we’d love to hear from you. Apply today!To apply for the job; do so with your Resume on this job page.For a confidential conversation or more info, please call Sean;0483 908 014, or(07) 3186 2106.",data\raw\Unknown_Company_DATA  BUSINESS ANALYST  ENERGY_87425061_20250926_165615,2025-09-26T16:56:25.130802
https://www.seek.com.au/job/87420715?type=standard&ref=search-standalone#sol=5b400f5d7290183c003680a815d44d19a004c517,Data Analyst,Melbourne VIC(Hybrid),Business/Systems Analysts (Information & Communication Technology),Full time,,"About Us:We are proudly owned by Auto & General Insurance Company. The A&G group is made up of trusted and well-known brands such as iSelect, Compare the Market and Budget Direct. In late 2024, iSelect and Compare the Market formed a new aggregation business within the A&G group that continues to support millions of Australians to compare and buy their personal finance, and household products such as insurance, energy, and loans.The Opportunity:Are you ready to elevate your career to the next level?We're seeking a Data Analyst to analyse complex data sets to deliver actionable insights that drive business decisions and growth. You'll collaborate with stakeholders, business analysts, and data engineers to translate requirements into effective reporting solutions. A strong focus will be on understanding data structures and platforms to optimize analytics and performance.Data Analysis & Reporting:Collect and analyse large datasets to identify trends and insights. Develop clear reports, dashboards, and visualizations for stakeholders.Performance Measurement:Define and track KPIs aligned with business goals. Identify areas for improvement and recommend strategies.Business Insights:Collaborate with cross-functional teams to translate business needs into data-driven insights, driving process and revenue improvements.Data Modelling & Profiling:Work with data engineers to analyse and profile data for use in production models supporting analytics.Data Quality Assurance:Ensure data accuracy and integrity through validation checks and by resolving anomalies.Trend & Market Analysis:Monitor industry trends and emerging technologies to deliver innovative, competitive insights.Data Visualization:Build interactive dashboards and visualizations using BI tools (e.g., Power BI, Tableau) for clear communication of data insights.Benefits:At Compare the Market and iSelect we offer a dynamic and collaborative work environment where your talents will be recognised and rewarded. You’ll have the opportunity to make a meaningful impact and contribute to our continued success, we also provide:Vibrant and social community who have annual celebrations, family fun days and regular events.Enjoy flexible work arrangements, including the option of one day working from home each week or a 9-day fortnight.Enjoy additional leave days - ‘ME’ leave and ‘Volunteer Day’ leave.Employee discounts on Car, Home, Travel insurance.Income protection insurance provided to support you in the event of non-work-related illness or injury.About you:Bachelor’s or Master’s degree in Computer Science, Statistics, Mathematics, Engineering, or a related field2–5+ years of experience in data analytics, data science, or a related roleStrong proficiency in SQL and database systems; working knowledge of PythonExperience with data visualization tools such as Tableau, Power BI, Cognos, or LookerFamiliarity with cloud platforms such as AWS, GCP, or AzureExperience or knowledge of AI technologies such as Large Language Models (LLMs), Retrieval-Augmented Generation (RAG), or agent-based systemsWant to know more? apply now!At Compare the Market and iSelect and we’re proud to be an Equal Opportunity Employer and we embrace diversity.This role is available to candidates with unlimited Australian working rights only.Compare the Market and iSelect are committed to protecting your privacy. All applications and personal information are kept confidential and securely stored in line with Australian privacy laws, used only for recruitment purposes, and not shared with third parties outside the Auto & General Holdings Group without your consent.",data\raw\Unknown_Company_Data Analyst_87420715_20250926_165640,2025-09-26T16:56:47.421720
https://www.seek.com.au/job/87389186?type=standard&ref=search-standalone#sol=4db7c9400f3b678beabdddd498d3ccbf6fdb7706,Data Engineer,Melbourne VIC,Developers/Programmers (Information & Communication Technology),Full time,,"About the RoleWe are seeking an experienced AzureData Engineerto join our team and play a pivotal role in designing, building, and maintaining high-performance data solutions on the Microsoft Azure platform. This role will focus on enabling enterprise-wide data accessibility and insights, working with Azure Synapse Analytics, SQL databases, and Power BI.The ideal candidate will be passionate about data, analytics, and reporting best practices, with strong SQL, Power BI, and data modelling skills. You will work collaboratively with business analysts, data scientists, and application developers to ensure accurate, high-quality, and actionable data solutions.Key ResponsibilitiesDesign and implement data models using fact and dimension tables, star and snowflake schemas; develop semantic layers and tabular models for reporting.Build, optimize, and maintain data pipelines, notebooks, and data flows using Azure Synapse Analytics, SQL databases, Python / PySpark. Integrate data from multiple sources ensuring accuracy and consistency.Develop and maintain Power BI datasets, dashboards, and reports; optimize data models for performance and usability.Implement best practices for data validation, cleansing, and transformation; ensure data accuracy, integrity, and compliance with governance standards.Tune SQL queries, indexes, and data models for maximum efficiency; monitor and improve ETL pipelines and reporting solutions.Work closely with stakeholders to support data-driven decision-making; provide guidance on Azure data services and data modelling best practices.What You’ll Bring:Minimum 3 years of experience in a Data Engineering or similar role.Retail industry experience is desirable.Bachelor’s degree in Computer Science, Information Systems, Data Engineering, or related field (or equivalent experience).Microsoft Azure certifications (e.g., Azure Data Engineer Associate) are highly desirable.Advanced SQL skills (query writing, stored procedures, performance tuning).Strong experience with Azure Data Factory, Azure Synapse Analytics, Azure SQL Database, serverless and dedicated pools, Spark transformations, PySpark.Proficient in Power BI (data modelling, DAX, reporting, optimization).Strong understanding of fact/dimension tables, star and snowflake schemas.Hands-on experience with ETL/ELT processes and data warehousing best practices.Familiarity with Azure Data Lake or similar big data tools.Knowledge of Dynamics 365 Commerce data model and Dataverse is a plus.Familiarity with Power Platform and Copilot Studio is advantageous.Excellent analytical, problem-solving, and communication skills.Why Join UsThis is a unique opportunity to work on large-scale data solutions and analytics projects that directly impact business decisions. You’ll be part of a collaborative team that values innovation, quality, and professional growth.Apply NowIf you are a driven Data Engineer passionate about Azure and data analytics, we want to hear from you.",data\raw\Unknown_Company_Data Engineer_87389186_20250926_165643,2025-09-26T16:56:48.908070
https://www.seek.com.au/job/87160866?type=standard&ref=search-standalone#sol=02493b73741174df201dc0500d2ecefe3ec02f91,Rolling Stock Data Scientist,Melbourne VIC,"Analysis & Reporting (Manufacturing, Transport & Logistics)",Full time,,"Role PurposeAt Yarra Trams, we're committed to delivering world-class transport services. As a Data Analyst, you'll help drive smarter decision-making by improving how we manage and use data across the business.You will contribute to this by:Turning complex data into clear, actionable insightsBuilding dashboards and reports that support smarter decisionsCollaborating across teams to improve data consistencySupporting OCMS with data-driven solutions and improvementsCommunicating insights in a way that's easy to understandDriving data quality and accuracy across systemsIdentifying opportunities to improve how we use dataKey AccountabilitiesIn this role, you will:Map Yarra Trams data to Transmodel standardsAnalyse large, multi-source datasets to uncover insightsDevelop and apply data quality metrics and standardsBuild models, dashboards, and reports for OCMS stakeholdersDesign and run A/B tests to evaluate strategiesTranslate data into clear recommendations for all audiencesShare best practices across Yarra Trams data teamsSupport project planning and delivery with OCMS and vendorsQualificationsBachelor's degree in IT, Statistics, Mathematics, or related fieldExperience & KnowledgeTo succeed in this role, you'll bring:Proven experience in IT or data analysis rolesStrong skills in SQL, Excel, and Power BIExperience with XML and business process analysisAbility to spot trends and patterns in complex dataKnowledge of data modelling and database designExcellent communication and stakeholder engagement skillsA collaborative mindset and cross-functional teamwork experience",data\raw\Unknown_Company_Rolling Stock Data Scientist_87160866_20250926_165642,2025-09-26T16:56:48.395207
https://www.seek.com.au/job/87425839?type=standard&ref=search-standalone#sol=4f4fa98a8b2fc46fa7607dbf68d419ddd6015454,Senior BI Developer,Melbourne VIC,Government - State (Government & Defence),Full time,,"24-month fixed term contract with strong potential to extendMelbourne CBD Location - Government AgencySalary From $138,000 to $160,000 + SuperThis Government Agency is seeking a Senior BI Developer to play a central role in advancing the Data Analytics Platform. Design and deliver advanced analytics solutions that transform structured and unstructured data into actionable insights, by leveraging Power BI, Azure data services, and data modelling techniques.ResponsibilitiesLead the design and development data models, pipelines, and reporting solutions within Azure and Power BI.Translate complex business needs into dashboards and reports that drive operational improvementsChampion best practices in BI solution design, data governance, lifecycle management, and security.Partner with stakeholders to ensure analytics solutions deliver measurable valueBuild organisational capability by mentoring team members, conducting training, and enabling self-service analytics.You will have5+ years' experience as a Power BI Developer, with strong skills in data modelling, visualisation and reporting.Advanced SQL expertise, with hands-on ETL and Azure-based data modelling experience.Experience with the Microsoft BI stack (Power BI, SSAS, SSRS, SSIS, PowerApps).Strong stakeholder engagement and communication skills, able to translate technical concepts into business value.Desirable: knowledge of scripting languages (Python) and Azure DevOpsWhat's in it for you24-month fixed term contract with strong potential to extendMelbourne CBD Location - Government AgencySalary From $138,000 to $160,000 + SuperExpress your interest to by clicking the 'Apply Now' button below",data\raw\Unknown_Company_Senior BI Developer_87425839_20250926_165707,2025-09-26T16:57:15.100073
